{"format":"foldnano","formatVersion":1,"savedWith":{"app":"0.5.1","commit":"a138eec4"},"id":"75a2aa71-d8c9-4713-b3a6-64917fa91dbd","name":"nontrivial_uiuc","parts":[{"name":"nontrivial.json","id":"ea77a6b7-3084-41e1-b64b-af963c4aed0a","planes":[{"id":"a17d5a3a-dccc-4184-a1b8-455c2ad830ce","name":"Plane 1","origin":{"x":0,"y":0,"z":0},"u":{"x":1,"y":0,"z":0},"v":{"x":0,"y":1,"z":0},"normal":{"x":0,"y":0,"z":1}}],"regions":[{"id":"4d490973-77db-45c3-9eb5-d14ae75a0621","name":"HONEYCOMB Region 1","kind":"HONEYCOMB","planeId":"a17d5a3a-dccc-4184-a1b8-455c2ad830ce","vhOrder":["6aa1b922-2497-436b-b4ca-c6ca68ee08c9","59ca79f5-895f-4b2b-863c-c0eff2cbca5d","cf96a349-7b5c-4aee-92bf-34f9053f6522","437eeb45-0923-4014-a322-d8ef04afe1d6"],"step":21,"turnsPerStep":2,"subStepSize":7,"twistOffset":340,"minBase":0,"maxBase":42}],"oligos":[{"id":"e8146d4e-2808-4534-a8c4-18d3c47045aa","segments":[{"id":"89e77e68-6929-46ab-9185-d819c7705cf9","inVirtualHelixIndex":1,"fivePrime":{"segmentId":"89e77e68-6929-46ab-9185-d819c7705cf9","isThreePrime":false,"index":5,"connectedSegmentId":null,"modification":null,"isConstrained":false},"threePrime":{"segmentId":"89e77e68-6929-46ab-9185-d819c7705cf9","isThreePrime":true,"index":13,"connectedSegmentId":"6705495f-4c34-4ac4-8d9f-6f1d7f4dbf73","modification":null,"isConstrained":true},"sequence":"NNNNNNN","slots":[{"bpIndex":5,"seq":"N"},{"bpIndex":6,"seq":"N"},{"bpIndex":7,"seq":"N"},{"bpIndex":8,"seq":"N"},{"bpIndex":9,"seq":""},{"bpIndex":10,"seq":""},{"bpIndex":11,"seq":"N"},{"bpIndex":12,"seq":"N"},{"bpIndex":13,"seq":"N"}]},{"id":"6705495f-4c34-4ac4-8d9f-6f1d7f4dbf73","inVirtualHelixIndex":2,"fivePrime":{"segmentId":"6705495f-4c34-4ac4-8d9f-6f1d7f4dbf73","isThreePrime":false,"index":13,"connectedSegmentId":"89e77e68-6929-46ab-9185-d819c7705cf9","modification":null,"isConstrained":true},"threePrime":{"segmentId":"6705495f-4c34-4ac4-8d9f-6f1d7f4dbf73","isThreePrime":true,"index":1,"connectedSegmentId":null,"modification":null,"isConstrained":false},"sequence":"NNNNNNNNNNNNNNN","slots":[{"bpIndex":13,"seq":"N"},{"bpIndex":12,"seq":"N"},{"bpIndex":11,"seq":"N"},{"bpIndex":10,"seq":"NN"},{"bpIndex":9,"seq":"NN"},{"bpIndex":8,"seq":"N"},{"bpIndex":7,"seq":"N"},{"bpIndex":6,"seq":"N"},{"bpIndex":5,"seq":"N"},{"bpIndex":4,"seq":"N"},{"bpIndex":3,"seq":"N"},{"bpIndex":2,"seq":"N"},{"bpIndex":1,"seq":"N"}]}],"color":"#b8056c","isScaffold":false,"isSequenceLocked":false,"name":""},{"id":"b2539155-6eb0-49a1-8d80-02bdfce97dce","segments":[{"id":"6f00fca9-5f6e-4de6-897d-1ccbe6e29fab","inVirtualHelixIndex":2,"fivePrime":{"segmentId":"6f00fca9-5f6e-4de6-897d-1ccbe6e29fab","isThreePrime":false,"index":5,"connectedSegmentId":null,"modification":null,"isConstrained":false},"threePrime":{"segmentId":"6f00fca9-5f6e-4de6-897d-1ccbe6e29fab","isThreePrime":true,"index":18,"connectedSegmentId":null,"modification":null,"isConstrained":false},"sequence":"NNNNNNNNNNNNNNNN","slots":[{"bpIndex":5,"seq":"N"},{"bpIndex":6,"seq":"N"},{"bpIndex":7,"seq":"N"},{"bpIndex":8,"seq":"N"},{"bpIndex":9,"seq":"NN"},{"bpIndex":10,"seq":"NN"},{"bpIndex":11,"seq":"N"},{"bpIndex":12,"seq":"N"},{"bpIndex":13,"seq":"N"},{"bpIndex":14,"seq":"N"},{"bpIndex":15,"seq":"N"},{"bpIndex":16,"seq":"N"},{"bpIndex":17,"seq":"N"},{"bpIndex":18,"seq":"N"}]}],"color":"#0066cc","isScaffold":false,"isSequenceLocked":false,"name":""},{"id":"6337311f-99e5-477d-b887-e1237639dd62","segments":[{"id":"6d6f756f-3c3c-440e-acc2-f0f2b301c126","inVirtualHelixIndex":2,"fivePrime":{"segmentId":"6d6f756f-3c3c-440e-acc2-f0f2b301c126","isThreePrime":false,"index":20,"connectedSegmentId":null,"modification":null,"isConstrained":false},"threePrime":{"segmentId":"6d6f756f-3c3c-440e-acc2-f0f2b301c126","isThreePrime":true,"index":35,"connectedSegmentId":null,"modification":null,"isConstrained":false},"sequence":"NNNNNNNNNNNNNNNN","slots":[{"bpIndex":20,"seq":"N"},{"bpIndex":21,"seq":"N"},{"bpIndex":22,"seq":"N"},{"bpIndex":23,"seq":"N"},{"bpIndex":24,"seq":"N"},{"bpIndex":25,"seq":"N"},{"bpIndex":26,"seq":"N"},{"bpIndex":27,"seq":"N"},{"bpIndex":28,"seq":"N"},{"bpIndex":29,"seq":"N"},{"bpIndex":30,"seq":"N"},{"bpIndex":31,"seq":"N"},{"bpIndex":32,"seq":"N"},{"bpIndex":33,"seq":"N"},{"bpIndex":34,"seq":"N"},{"bpIndex":35,"seq":"N"}]}],"color":"#0066cc","isScaffold":false,"isSequenceLocked":false,"name":""},{"id":"1dfebc42-9d73-45f7-bf4a-66692de49a59","segments":[{"id":"9fabec22-7546-4206-b115-f4d6cd3a5cc3","inVirtualHelixIndex":2,"fivePrime":{"segmentId":"9fabec22-7546-4206-b115-f4d6cd3a5cc3","isThreePrime":false,"index":35,"connectedSegmentId":null,"modification":null,"isConstrained":false},"threePrime":{"segmentId":"9fabec22-7546-4206-b115-f4d6cd3a5cc3","isThreePrime":true,"index":14,"connectedSegmentId":"d937804b-b162-4700-8e6e-c19ab846f1af","modification":null,"isConstrained":true},"sequence":"NNNNNNNNNNNNNNNNNNNNNN","slots":[{"bpIndex":35,"seq":"N"},{"bpIndex":34,"seq":"N"},{"bpIndex":33,"seq":"N"},{"bpIndex":32,"seq":"N"},{"bpIndex":31,"seq":"N"},{"bpIndex":30,"seq":"N"},{"bpIndex":29,"seq":"N"},{"bpIndex":28,"seq":"N"},{"bpIndex":27,"seq":"N"},{"bpIndex":26,"seq":"N"},{"bpIndex":25,"seq":"N"},{"bpIndex":24,"seq":"N"},{"bpIndex":23,"seq":"N"},{"bpIndex":22,"seq":"N"},{"bpIndex":21,"seq":"N"},{"bpIndex":20,"seq":"N"},{"bpIndex":19,"seq":"N"},{"bpIndex":18,"seq":"N"},{"bpIndex":17,"seq":"N"},{"bpIndex":16,"seq":"N"},{"bpIndex":15,"seq":"N"},{"bpIndex":14,"seq":"N"}]},{"id":"d937804b-b162-4700-8e6e-c19ab846f1af","inVirtualHelixIndex":1,"fivePrime":{"segmentId":"d937804b-b162-4700-8e6e-c19ab846f1af","isThreePrime":false,"index":14,"connectedSegmentId":"9fabec22-7546-4206-b115-f4d6cd3a5cc3","modification":null,"isConstrained":true},"threePrime":{"segmentId":"d937804b-b162-4700-8e6e-c19ab846f1af","isThreePrime":true,"index":20,"connectedSegmentId":"5a39c458-c747-4c1d-ae89-d83705aec18b","modification":null,"isConstrained":true},"sequence":"NNNNNNN","slots":[{"bpIndex":14,"seq":"N"},{"bpIndex":15,"seq":"N"},{"bpIndex":16,"seq":"N"},{"bpIndex":17,"seq":"N"},{"bpIndex":18,"seq":"N"},{"bpIndex":19,"seq":"N"},{"bpIndex":20,"seq":"N"}]},{"id":"5a39c458-c747-4c1d-ae89-d83705aec18b","inVirtualHelixIndex":0,"fivePrime":{"segmentId":"5a39c458-c747-4c1d-ae89-d83705aec18b","isThreePrime":false,"index":20,"connectedSegmentId":"d937804b-b162-4700-8e6e-c19ab846f1af","modification":null,"isConstrained":true},"threePrime":{"segmentId":"5a39c458-c747-4c1d-ae89-d83705aec18b","isThreePrime":true,"index":5,"connectedSegmentId":null,"modification":null,"isConstrained":false},"sequence":"NNNNNNNNNNNNNN","slots":[{"bpIndex":20,"seq":"N"},{"bpIndex":19,"seq":""},{"bpIndex":18,"seq":""},{"bpIndex":17,"seq":"N"},{"bpIndex":16,"seq":"N"},{"bpIndex":15,"seq":"N"},{"bpIndex":14,"seq":"N"},{"bpIndex":13,"seq":"N"},{"bpIndex":12,"seq":"N"},{"bpIndex":11,"seq":"N"},{"bpIndex":10,"seq":"N"},{"bpIndex":9,"seq":"N"},{"bpIndex":8,"seq":"N"},{"bpIndex":7,"seq":"N"},{"bpIndex":6,"seq":"N"},{"bpIndex":5,"seq":"N"}]}],"color":"#f74308","isScaffold":false,"isSequenceLocked":false,"name":""},{"id":"7476386e-bbed-4fd5-92de-d616fc294d62","segments":[{"id":"ff2830c3-8281-444c-a205-fd09be40adba","inVirtualHelixIndex":4,"fivePrime":{"segmentId":"ff2830c3-8281-444c-a205-fd09be40adba","isThreePrime":false,"index":1,"connectedSegmentId":null,"modification":null,"isConstrained":false},"threePrime":{"segmentId":"ff2830c3-8281-444c-a205-fd09be40adba","isThreePrime":true,"index":18,"connectedSegmentId":"2942c20c-f2c6-4e8d-97f8-a8c47b774bb1","modification":null,"isConstrained":false},"sequence":"NNNNNNNNNNNNNNNNNNNNNNNNNNNN","slots":[{"bpIndex":1,"seq":"N"},{"bpIndex":2,"seq":"N"},{"bpIndex":3,"seq":"N"},{"bpIndex":4,"seq":"N"},{"bpIndex":5,"seq":"N"},{"bpIndex":6,"seq":"N"},{"bpIndex":7,"seq":"N"},{"bpIndex":8,"seq":"N"},{"bpIndex":9,"seq":"N"},{"bpIndex":10,"seq":"N"},{"bpIndex":11,"seq":"N"},{"bpIndex":12,"seq":"NNNNNNNNNNN"},{"bpIndex":13,"seq":"N"},{"bpIndex":14,"seq":"N"},{"bpIndex":15,"seq":"N"},{"bpIndex":16,"seq":"N"},{"bpIndex":17,"seq":"N"},{"bpIndex":18,"seq":"N"}]},{"id":"2942c20c-f2c6-4e8d-97f8-a8c47b774bb1","inVirtualHelixIndex":4,"fivePrime":{"segmentId":"2942c20c-f2c6-4e8d-97f8-a8c47b774bb1","isThreePrime":false,"index":20,"connectedSegmentId":"ff2830c3-8281-444c-a205-fd09be40adba","modification":null,"isConstrained":false},"threePrime":{"segmentId":"2942c20c-f2c6-4e8d-97f8-a8c47b774bb1","isThreePrime":true,"index":34,"connectedSegmentId":null,"modification":null,"isConstrained":false},"sequence":"NNNNNNNNNNNNNNN","slots":[{"bpIndex":20,"seq":"N"},{"bpIndex":21,"seq":"N"},{"bpIndex":22,"seq":"N"},{"bpIndex":23,"seq":"N"},{"bpIndex":24,"seq":"N"},{"bpIndex":25,"seq":"N"},{"bpIndex":26,"seq":"N"},{"bpIndex":27,"seq":"N"},{"bpIndex":28,"seq":"N"},{"bpIndex":29,"seq":"N"},{"bpIndex":30,"seq":"N"},{"bpIndex":31,"seq":"N"},{"bpIndex":32,"seq":"N"},{"bpIndex":33,"seq":"N"},{"bpIndex":34,"seq":"N"}]}],"color":"#0066cc","isScaffold":false,"isSequenceLocked":false,"name":""},{"id":"9bd62d13-9552-4075-a4f0-e9409433c975","segments":[{"id":"79df0a51-e16c-40d2-bfe8-a8bea39afbd6","inVirtualHelixIndex":4,"fivePrime":{"segmentId":"79df0a51-e16c-40d2-bfe8-a8bea39afbd6","isThreePrime":false,"index":34,"connectedSegmentId":null,"modification":null,"isConstrained":false},"threePrime":{"segmentId":"79df0a51-e16c-40d2-bfe8-a8bea39afbd6","isThreePrime":true,"index":28,"connectedSegmentId":"8847df1f-722d-47a7-a1ce-6b3159a9cce0","modification":null,"isConstrained":true},"sequence":"NNNNNNN","slots":[{"bpIndex":34,"seq":"N"},{"bpIndex":33,"seq":"N"},{"bpIndex":32,"seq":"N"},{"bpIndex":31,"seq":"N"},{"bpIndex":30,"seq":"N"},{"bpIndex":29,"seq":"N"},{"bpIndex":28,"seq":"N"}]},{"id":"8847df1f-722d-47a7-a1ce-6b3159a9cce0","inVirtualHelixIndex":1,"fivePrime":{"segmentId":"8847df1f-722d-47a7-a1ce-6b3159a9cce0","isThreePrime":false,"index":28,"connectedSegmentId":"79df0a51-e16c-40d2-bfe8-a8bea39afbd6","modification":null,"isConstrained":true},"threePrime":{"segmentId":"8847df1f-722d-47a7-a1ce-6b3159a9cce0","isThreePrime":true,"index":36,"connecte